title,author,date,abstract,column,url
Duke's statement on North Carolina's new abortion restriction is inappropriate,Paige Brasington,2023-06-08,"By sending this email voicing opposition to North Carolina’s new law, Duke signals that many viewpoints are not welcome here.",Opinion,https://www.dukechronicle.com/article/2023/06/060823-brasington-abortion-restriction-statement
"Fortifying yourself, and other impossible lessons",Sasha Richie,2023-05-08,"Being a woman in leadership, especially in a male-dominated industry, is often a gunfight you were given a knife for. ",Campus Voices,https://www.dukechronicle.com/article/2023/05/richie-fortifying-yourself-and-other-impossible-lessons
Standing still,Milla Surjadi,2023-05-06,"So perhaps the measure of our devotion — to a piece of writing, to an institution, to an industry — is our belief in its potential. When you stand still and look around, what do you see in the negative space? ",Campus Voices,https://www.dukechronicle.com/article/2023/05/surjadi-standing-still-farewell-column
Durham must address the urban heat island effect and equity in its development ordinances,Chloe Brenner,2023-05-05,"In order to mitigate the negative effects of extreme heat and ensure that communities of color are adequately protected, Durham must amend its city Tree Ordinance and collaborate with vulnerable communities to target planting.",Opinion,https://www.dukechronicle.com/article/2023/05/050523-brenner-durham-tree-ordinance
Duke should offer ASL as a language,Jocelyn Chin,2023-05-02,"American Sign Language should be formally taught at Duke because it is practical, increases accessibility, and contains a rich history and diverse community that students would benefit to learn from.",Campus Voices,https://www.dukechronicle.com/article/2023/05/chin-05022023-duke-should-offer-asl-language
All Durham needs is love and crosswalks ,Katherine Gallagher,2023-05-02,"What was the Beatles' greatest accomplishment? It was neither selling over 1 billion records worldwide, nor revolutionizing the entire music industry nor becoming a major symbol of the 1960s social and cultural transformation. What people don't realize is that John Lennon, Paul McCartney, George Harrison and Ringo Starr were actually pioneers of public safety. ",Opinion,https://www.dukechronicle.com/article/2023/05/050223-gallagher-durham-walkability
The most talented room on campus,Em Adler,2023-05-01,"As long as Chronicle Sports exists, some immensely talented handful of friends will always be walking across the quad at some obscenely early hour in the morning. And the sun will always rise over Abele Quad.",Campus Voices,https://www.dukechronicle.com/article/2023/05/050123-adler-talented-room-campus
Feeling burnt out? Lessons from Latino culture on the politics of rest ,Luna Abadía,2023-05-01,"If you really think about it, the only choice we have is rest.",Opinion,https://www.dukechronicle.com/article/2023/05/050123-abadia-latino-culture-rest
Duke alumni letter supporting the Duke Graduate Students Union,Gino Nuzzolillo,2023-04-28,We pledge to cease our donations and other forms of in-kind support to the University until Duke ends its obstruction of graduate student workers’ right to unionize and collectively bargain.,Opinion,https://www.dukechronicle.com/article/2023/04/042623-alumni-letter-supporting-dgsu
Isn’t it nice?,Leah Boyd,2023-04-26,"In reality, moments, they are beautiful and fleeting and raw, but they say nothing, really. It is our job to bring them to life.",Campus Voices,https://www.dukechronicle.com/article/2023/04/boyd-isnt-it-nice
One last story to tell,Jonathan Levitan,2023-04-26,"Family is behind every great story in sports, from San Francisco to Philadelphia to Durham. It’s behind my story, too.",Campus Voices,https://www.dukechronicle.com/article/2023/04/levitan-one-last-story-to-tell
In the clouds,Marina Chen,2023-04-26,"It's a gift to take a step back with a columnist, to help them look at that puffy, wet wisp of an idea and condense it until it becomes water. ",Campus Voices,https://www.dukechronicle.com/article/2023/04/chen-in-the-clouds
My leap of faith,Katie Tan,2023-04-26,"When the clock strikes midnight, the realization that my tenure has come to an end will slowly sink in, and I’ll reflect with certainty on how taking that leap of faith was the best decision I have ever made.",Campus Voices,https://www.dukechronicle.com/article/2023/04/tan-my-leap-of-faith
Something bigger than ourselves ,Kathryn Thomas,2023-04-26,"The work of student journalism is never done; it only changes hands again, again, and again. One-hundred-and-eighteen times to be exact. ",Campus Voices,https://www.dukechronicle.com/article/2023/04/thomas-something-bigger-than-ourselves
The ballad of twenty,Ooha Reddy,2023-04-26,"At twenty, I am confident and lost, and at twenty, my mother got married.",Campus Voices,https://www.dukechronicle.com/article/2023/04/042623-reddy-the-ballad-of-twenty
The art of seeing  ,Chris Kuo,2023-04-24,Each of us must find our way of living and loving attentively — our own way of spotting the many pennies of this world.,Campus Voices,https://www.dukechronicle.com/article/2023/04/230424-kuo-the-art-of-seeing
The Chronicle gave me so much,Jake C. Piazza,2023-04-24,"Thanks to The Chronicle, I got a front-row seat, many times literally, to witness and document all of this and more. ",Campus Voices,https://www.dukechronicle.com/article/2023/04/230424-piazza-the-chronicle-gave-me-so-much
Being part of something that will outlast all of us,Parker Harris,2023-04-24,Nowhere else will you so readily be equipped to do so much.,Campus Voices,https://www.dukechronicle.com/article/2023/04/042423-harris-being-part-of-something-that-will-outlast-all-of-us
Four years in 700 words,Alex Jackson,2023-04-24,All I really have to say is that I'm thankful for the opportunities I had here.,Campus Voices,https://www.dukechronicle.com/article/2023/04/042423-jackson-four-years-in-700-words
I’m not going birding (and why I belong here anyways),Jonathan Pertile,2023-04-24,"I hate to break it to everyone, but all y’all Duke students are so exceptional.",Campus Voices,https://www.dukechronicle.com/article/2023/04/042423-pertile-im-not-going-birding-and-why-i-belong-here-anyways
No one reads Monday Monday anyway,Chase Pellegrini de Paur and Monday Monday,2023-04-24,AI wrote this column and is now coming to steal your girlfriend. Humans are causing a mass extinction event. The world is burning. Boo. Whatever. No one reads The Chronicle. No one reads the anonymous satirist. ,Campus Voices,https://www.dukechronicle.com/article/2023/04/230424-no-one-reads-monday-monday-anyway
How did we get here?,Babu Chatterjee,2023-04-24,It is not possible to do this by accident. To experience everything takes at least ninety minutes.,Campus Voices,https://www.dukechronicle.com/article/2023/04/042423-chatterjee-how-did-we-get-here
Four years of highlights,Max Rego,2023-04-24,"In between all the talk about the latest news coming out of Duke athletics, I was able to form lasting friendships, friendships that will continue well after graduation.",Campus Voices,https://www.dukechronicle.com/article/2023/04/042423-rego-four-years-of-highlights
I joined Recess by mistake. I’m so glad that I did. ,Ben Smith,2023-04-24,"""Why not,"" I said. I never did go to any other department meetings.",Campus Voices,https://www.dukechronicle.com/article/2023/04/042523-smith-i-joined-recess-by-mistake-im-so-glad-that-i-did
That time I reviewed music for two years,Rhys Banerjee,2023-04-24,"I’ve, without a doubt, enjoyed my time writing for the Duke Chronicle. Despite this, after I graduate, I’ll probably never write another music review again.",Campus Voices,https://www.dukechronicle.com/article/2023/04/042423-banerjee-that-time-i-reviewed-music-for-two-years
SHAPE's demands to administrators for a safer Duke,Duke SHAPE,2023-04-18,"We want to see the day when Duke doesn’t need SHAPE. Until then, SHAPE will be on the front line igniting cultural and institutional, survivor-centric change.",Opinion,https://www.dukechronicle.com/article/2023/04/230417-duke-shape-demands-sexual-harassment-assault-prevention-education
47 seconds is the average…and it shouldn’t be,Linda Cao,2023-04-18,"With our minds quickly switching to the next tab, moving onto the next big trend, our focus shifts horrifically easy. ",Campus Voices,https://www.dukechronicle.com/article/2023/04/041823-cao-47-seconds-average
A letter from you one day soon,Advikaa Anand,2023-04-18,"Because as you will soon realize, to grow up and become who you were meant to be and not merely someone’s child, someone’s friend, someone’s sibling, you have to do life on your own. ",Campus Voices,https://www.dukechronicle.com/article/2023/04/041823-anand-a-letter-from-you-one-day-soon
Joy on the journey,Luke A. Powery,2023-04-17,Nearing the end of the semester — with graduation approaching for some — I suspect many students experience some mixture of fear and joy at the uncertainty of what lies ahead.,Campus Voices,https://www.dukechronicle.com/article/2023/04/031723-end-of-year
Recognizing Duke Theater’s scene and costume shops ,Ash Jeffers,2023-04-17,"The Shops, David, and Erin were integral to my experience at Duke, for and beyond everything they taught me about theater.",Opinion,https://www.dukechronicle.com/article/2023/04/041423-jeffers-theater-costume-shops
Climate change is irreversible; we need to bang right now,Monday Monday,2023-04-16,"Whether you’re reading this on a Monday night or a Thursday morning, it is absolutely essential that you and I engage in amazing and consensual sex before our planet is consumed by the biblically foretold devastation of climate destruction. ",Campus Voices,https://www.dukechronicle.com/article/2023/04/230417-monday-monday-please-text-me
A fair-weather campus,Heidi Smith,2023-04-16,"Clearly, we don’t owe a friend the same commitment as a boyfriend, but is a single 30-minute lunch once a week despite all else going on too much to ask?",Campus Voices,https://www.dukechronicle.com/article/2023/04/04012023-smith-fair-weather-campus
We can't accept defeat in the fight for immigration reform,Sofia Cava,2023-04-14,"As we asked question after question hoping to hear at least one encouraging response, we were repeatedly told that the issue of immigration was too complex and politicized to address at this time.",Opinion,https://www.dukechronicle.com/article/2023/04/041323-cava-immigration-reform
Ozempic: blood sugar stabilizer or miracle weight-loss drug?,Nik Narain,2023-04-14,"As Ozempic comes out of shortage, will patients and healthcare professionals be more responsible in rationing prescriptions to those who need them for medical over cosmetic reasons? ",Campus Voices,https://www.dukechronicle.com/article/2023/04/041423-narain-ozempic-blood-sugar-stabilizer-or-miracle-weight-loss-drug
On the silence from Duke admin on the proposed North Carolina abortion ban,Duke Planned Parenthood Generation Action Exec,2023-04-13,"House Bill 533, also known as the “The Human Life Protection Act”, was proposed by Rep. Keith Kidwell (R-Beaufort) very recently... 1 in 4 women will receive abortions in their lives, and Duke students are no exception to that statistic.",Opinion,https://www.dukechronicle.com/article/2023/04/041323-planned-parenthood-generation-action-exec-proposed-nc-abortion-ban
Your disdain for Durham is embarrassing,Pilar González Kelly,2023-04-11,"When we Duke students leave our big cities and subdivisions behind and then complain about Durham, we reek of the entitlement and prejudice that has soured our relationship with this city and earned Duke names such as New Jersey University.",Campus Voices,https://www.dukechronicle.com/article/2023/04/041123-kelly-duke-disdain
"First nuts, now unions: Duke admin continues attempts to bust",Monday Monday,2023-04-10,"“Being an employee does not necessarily make you an employee,” said the provost. “Nugget, the beloved canine who was arguably golden and sometimes appeared to retrieve things, was not necessarily legally a golden retriever.""",Campus Voices,https://www.dukechronicle.com/article/2023/04/230409-monday-monday-union-busting
The GOP doesn’t care about you,Katelyn Sheets,2023-04-07,"My plea to Duke students, and really anyone in North Carolina, is to stay vigilant and speak out in support of common sense gun legislation.",Opinion,https://www.dukechronicle.com/article/2023/04/030723-sheets-nashville-desantis
Voting time extended for DSG elections,DSG Board of Elections,2023-04-06,We are extending voting time until 2 pm EST this afternoon to account for the time we took to fix and publicize the ballot. ,Opinion,https://www.dukechronicle.com/article/2023/04/230406-dsg-voting-time-extended-for-dsg-elections
"Death, passion, and Lamentations: Some reflections on Holy Week",Matthew Arakaky,2023-04-06,"Christ’s refusal to circumvent the question of suffering allows us to suffer well...We can repeat the same phrase back to Him: “Lord, this is my body…broken for You.”",Opinion,https://www.dukechronicle.com/article/2023/04/040623-arakaky-lamentations-holy-week-reflections
(Ongoing legal) actions speak louder than words,Duke Graduate Students Union Press Team,2023-04-05,"Duke could voluntarily recognize our union, or follow word with substantive action by dropping the NLRB challenge and committing the basic resources needed to hold elections now.",Letters to the Editor,https://www.dukechronicle.com/article/2023/04/040523-duke-graduate-students-union-nlrb-unionization-ongoing-legal-actions-speak-louder-than-words
If I die in a school shooting,Caroline Cornett,2023-04-03,"Don’t call me a daughter, or sister, or friend; call me a victim of the NRA and the people who would rather protect their right to own an assault rifle than the lives of their fellow human beings. ",Campus Voices,https://www.dukechronicle.com/article/2023/04/040423-cornett-in-a-school-shooting
A pillow for love,Luke A. Powery,2023-04-03,The tears being shed in Nashville and the tears cried here on campus...are never wasted because every drop forms a pillow for your heart of love.,Campus Voices,https://www.dukechronicle.com/article/2023/04/040323-powery-pillow-for-love
A bittersweet goodbye to The Phantom of the Opera,Sophie Ju,2023-04-03,"When the final curtain is drawn on Phantom in mid-April, it will not be an insignificant moment for Broadway. It is perhaps nostalgic for some, poignant for others and emphatically earth-shattering for a few. ",Campus Voices,https://www.dukechronicle.com/article/2023/04/040323-ju-phantom-opera-goodbye
Throwing shade: considering the implications of colorism,Advikaa Anand,2023-04-03,"The little voice in my head, engendered by years of wanting to be a lighter version of myself, still screams in repulsion when I spot a hint of hyperpigmentation on my skin.",Campus Voices,https://www.dukechronicle.com/article/2023/04/040323-anand-considering-the-impacts-of-colorism
We have too many clubs at this school,Heidi Smith,2023-04-02,"Unlike in high school, freshmen realize after a couple of months that there’s no point in doing a club unless they’re either genuinely passionate about it, it will help them professionally or they’re applying to graduate school later on.",Campus Voices,https://www.dukechronicle.com/article/2023/04/04032023-smith-too-many-clubs
To hell with 'meaningful dialogue': Why we walked out on Naftali Bennett,Duke Students for Justice in Palestine,2023-03-29,Duke University is complicit in apartheid. Hosting Zionist leaders is an act of normalization — one that we refuse to let go unprotested.,Opinion,https://www.dukechronicle.com/article/2023/03/033023-sjp-naftali-bennett-walk-out-protest
Statement from Durham County Sheriff Clarence Birkhead,Clarence Birkhead,2023-03-29,I support North Carolina Governor Roy Cooper’s quick veto of Senate Bill 41 which would remove a vital step in keeping guns out of the hands of people who would do harm to themselves or others.,Opinion,https://www.dukechronicle.com/article/2023/03/032923-birkhead
Naftali Bennett was invited for the sake of academic discourse. So why was there none?,Executive Board of Duke J Street U,2023-03-28,"It is Duke’s responsibility to ensure political speeches don’t get masqueraded as academic discourse, which is what we believe occurred this past Wednesday.",Opinion,https://www.dukechronicle.com/article/2023/03/032923-duke-j-street-u-naftali-bennett-event
Does comedy have to be funny?,Nik Narain,2023-03-28,"To say that comedy has to be funny is like saying visual art has to be pretty, or music has to be melodic.",Campus Voices,https://www.dukechronicle.com/article/2023/03/032823-narain-does-comedy-have-to-be-funny
What it takes to be a Duke student,Sonia Green,2023-03-28,"The pressure that doesn’t come from campus, classes, professors, extracurriculars or parents comes from ourselves, and I believe that is what pushes us to sacrifice so much. ",Campus Voices,https://www.dukechronicle.com/article/2023/03/032823-green-what-it-takes-to-be-a-duke-student
A heartbroken documentary community seeks answers,Center for Documentary Studies Community,2023-03-24,"We are asking President Price, Interim Provost Francis and others to comprehensively review what has occurred at CDS over the past 18 months — including the staff that have resigned and been laid off.",Letters to the Editor,https://www.dukechronicle.com/article/2023/03/032423-center-for-documentary-studies-community-duke-layoffs
Critics of Israel should engage with Naftali Bennett,Abdullah Antepli and David Schanzer,2023-03-21,"We will be attending the event featuring former Israeli prime minister Naftali Bennett at Duke this Wednesday because we believe that the only way these causes, as well as the imperative of peace, will be served is through meaningful dialogue, engagement and education.",Opinion,https://www.dukechronicle.com/article/2023/03/032123-antepli-schanzer-naftali-bennett-guest-speaker
A new season for NC Dems,Chloe Decker,2023-03-21,"With a young and driven leader like Anderson Clayton at the helm, there has never before been a more exciting time to be a progressive college student in North Carolina. ",Campus Voices,https://www.dukechronicle.com/article/2023/03/032123-decker-new-season-for-nc-dems
Are you uncomfortable? Good.,Linda Cao,2023-03-21,"America’s traumatic past has always been a tough pill for many to swallow, but I guess swallowing one’s pride is even harder.",Campus Voices,https://www.dukechronicle.com/article/2023/03/032123-cao-are-you-uncomfortable-good
Being blessed,Luke A. Powery,2023-03-20,"It is precisely those who suffer, who persevere against injustice, who lack riches—they are somehow closest to God’s blessing.",Campus Voices,https://www.dukechronicle.com/article/2023/03/032023-powery-being-blessed
Effortful Perfection,Heidi Smith,2023-03-19,"Unfortunately, regardless of whether you see effortless or effortful perfection as the goal, you’ll feel bad if you don’t achieve said perfection.",Campus Voices,https://www.dukechronicle.com/article/2023/03/03192023-smith-effortful-perfection
Statement in support of students' right to unionize ,Duke Graduate and Professional Student Government,2023-03-09,"We urge Duke University administration to remove misleading information from their website on graduate student unionization, to bargain in good faith if graduate student workers should authorize the designation of a union as their representation, and to be neutral and to not interfere with the upcoming union election.",Opinion,https://www.dukechronicle.com/article/2023/03/duke-graduate-professional-student-government-statement-in-support-of-students-right-to-unionize
How to have a good bad day,Advikaa Anand,2023-03-09," I stand in front of the mirror and smile — if I see myself smiling, surely I am happy.",Campus Voices,https://www.dukechronicle.com/article/2023/03/030923-anand-how-to-have-a-good-bad-day
To find our own definition of success,Sophie Ju,2023-03-09,"I’m aware that most days, I find myself being ""unsuccessful"" — for every ""A"" that I missed, every opportunity I was rejected from or even every sign of being ""less sociable and less creative"" than my peers.",Campus Voices,https://www.dukechronicle.com/article/2023/03/030923-ju-success-definition
We must stop Cop City,Pilar González Kelly,2023-03-08,"In a heartless instance of environmental racism, Cop City would tear precious green space from a community that needs it most, replacing sounds of wildlife with the sounds of police gunshots that have historically terrorized them.",Campus Voices,https://www.dukechronicle.com/article/2023/03/030823-kelly-cop-city
"Adam Silver is the commencement speaker we want, we crave, we need",Monday Monday,2023-03-06,Some uninformed souls may bemoan the selection of Mr. Silver as a step backwards for Duke. They may deride him as “just another cis/straight/rich/white/man.” They may say things like “Why couldn’t we get Obama?”,Campus Voices,https://www.dukechronicle.com/article/2023/03/030623-monday-monday-commencement-speaker
What are you doing with your dash?,Luke A. Powery,2023-03-06,Our mortality should shape our morality.,Opinion,https://www.dukechronicle.com/article/2023/03/030523-powery
Muslim Students Association endorses Isaiah Hamilton for DSG president,Muslim Students Association,2023-02-28,The Muslim Students Association is excited to endorse Isaiah Hamilton for DSG president.,Opinion,https://www.dukechronicle.com/article/2023/03/duke-student-government-president-endorsement-muslim-students-association-isaiah-hamilton
Society of Hispanic Professional Engineers endorses Isaiah Hamilton for DSG president,Society of Hispanic Professional Engineers,2023-02-28,"After careful deliberation, The Society of Hispanic Professional Engineers would like to officially endorse Isaiah Hamilton for DSG presidency.",Opinion,https://www.dukechronicle.com/article/2023/03/duke-student-government-president-endorsement-society-of-hispanic-professional-engineers-isaiah-hamilton
DukeAfrica endorses Isaiah Hamilton for DSG president,DukeAFRICA,2023-02-28,"After careful consideration, DukeAfrica is pleased to endorse Isaiah Hamilton as our next DSG president. ",Opinion,https://www.dukechronicle.com/article/2023/03/duke-student-government-president-endorsement-duke-africa-isaiah-hamilton
A letter from Washington,Chloe Decker,2023-02-28,"Whether you’re frolicing under a cherry blossom tree in D.C. next spring or another country entirely, don’t let the fear of missing out on what’s happening on campus hold you back from leaving Duke’s gothic gates. ",Campus Voices,https://www.dukechronicle.com/article/2023/02/022823-decker-a-letter-from-washington
We need to talk about binge eating.,Nik Narain,2023-02-28,"I was immersed in a campus food environment where disordered eating was not only the aspiration, but the norm.",Campus Voices,https://www.dukechronicle.com/article/2023/02/022823-narain-we-need-to-talk-about-binge-eating
ChatGPT and the role of the university,Heidi Smith,2023-02-27,"We shouldn’t be asking if students are cheating via ChatGPT, but rather why they feel the need to.",Campus Voices,https://www.dukechronicle.com/article/2023/02/02272023-smith-chatgpt
Engineering Student Government endorses Chase Barclay for DSG president,Duke Engineering Student Government,2023-02-27,Duke Engineering Student Government enthusiastically endorses Chase Barclay for Duke Student Government president.,Opinion,https://www.dukechronicle.com/article/2023/02/duke-student-government-president-endorsement-engineering-student-government-chase-barclay
An unhappy Valentine's Day,Advikaa Anand,2023-02-23,Its message is clear: we are worthy only if a chosen person recognizes that worth and elects to devote significant portions of their life to honoring that worth. ,Campus Voices,https://www.dukechronicle.com/article/2023/02/022322-anand-an-unhappy-valentines-day
Is nothing sacred anymore? ,Pilar González Kelly,2023-02-21,BeReal is especially toxic because it is performativity feigning authenticity.,Campus Voices,https://www.dukechronicle.com/article/2023/02/022023-kelly-be-real
What South Asian Americans owe to Civil Rights,Nik Narain,2023-02-21,"We tend to forget that Civil Rights have had a monumental impact on the South Asian American communities, not to mention several other marginalized identity groups as well.",Campus Voices,https://www.dukechronicle.com/article/2023/02/022123-narain-what-south-asian-americans-owe-to-civil-rights
"Chinese spy balloon murdered Gardens koi fish, per President Price",Monday Monday,2023-02-20,"While this may all seem trivial, the investigation explains that it is all part of a highly concerted effort to sow unhappiness in university students and make us all into communists.",Campus Voices,https://www.dukechronicle.com/article/2023/02/022023-monday-monday
Religio and the breach,Luke A. Powery,2023-02-20,"Religio is the Latin word for religion...at the center and heart of the university, architecturally and figuratively. ",Opinion,https://www.dukechronicle.com/article/2023/02/022023-powery
"Community message from Clarence Birkhead, Sheriff of Durham County",Clarence Birkhead,2023-02-18,"As your Sheriff, I want to hear from all of you to help us. Together, we are One Community, One Durham.",Opinion,https://www.dukechronicle.com/article/2023/02/021823-birkhead
Letter of thanks from Michigan State alum,Pat BeVier,2023-02-18,I’m sure I was not the only Michigan State Spartan fan brought to tears by hearing our school songs playing across the Duke University campus the day after our tragic events.,Letters to the Editor,https://www.dukechronicle.com/article/2023/02/021723-bevier
