title,author,date,abstract,column,url
Strangers as angels,Luke A. Powery,2024-01-29,"You might be experiencing tough times, your own wilderness. But I hope you don’t miss the deacons of God in your midst.",Campus Voices,https://www.dukechronicle.com/article/2024/01/012924-powery-strangers-angels
Personality tests and the absurdity of self-awareness,Nik Narain,2024-01-29,"Personality tests aren’t “scientific,” but self-understanding isn’t meant to be a scientific process.",Campus Voices,https://www.dukechronicle.com/article/2024/01/012924-narain-personality-tests-self-awareness
The case of overstimulation,Angikar Ghosal,2024-01-29,Intellectual posturing is almost always an offense and is only legal and celebrated for existing intellectuals who are already famous.,Campus Voices,https://www.dukechronicle.com/article/2024/01/012924-ghosal-case-of-overstimulation
In defense of the university,James Gao,2024-01-26,"This is the central paradox of the elite university: It is simultaneously America’s crown jewel and its black sheep, an embodiment of everything this country can achieve and everything it has failed to thus far.",Campus Voices,https://www.dukechronicle.com/article/2024/01/012624-gao-elite-universities-defense
The art of music snobbery,Susan Chemmanoor,2024-01-26,"The music crescendos and suddenly you’re there. You’re standing on a rain-soaked road and the daylight is dead, but you finally feel alive.",Campus Voices,https://www.dukechronicle.com/article/2024/01/012624-chemmanoor-mitski-music-emotions
Under these towering oaks no more ,Aaron Siegle,2024-01-26,The oaks have survived the first hundred years of Duke’s turbulent history. Let’s make sure they’ll be around one hundred years from now.,Campus Voices,https://www.dukechronicle.com/article/2024/01/012624-siegle-under-towering-oaks-no-more
A realist's perspective on grade inflation,Alex Berkman,2024-01-25,"Not only does hyper grade inflation diminish the value of true achievement, it also shields us from a reality that does not deliberately accommodate our success.",Campus Voices,https://www.dukechronicle.com/article/2024/01/012524-berkman-grade-inflation-prevent-learning
We will not wait for the next school shooting,Andrew Sun and Alexander Denza,2024-01-24,It's not simply our lives we protect with prose and protest. It is our way of life itself.,Opinion,https://www.dukechronicle.com/article/2024/01/012424-sun-denza-school-shooting
Motivation isn’t enough: Here’s how to achieve your goals,Anna Garziera,2024-01-24,"At the end of the day, it is not our future self that will be asked to work towards that goal, but our current self.",Campus Voices,https://www.dukechronicle.com/article/2024/01/012424-garziera-motivation-not-enough
New pre-professional society to focus on bumming around,Monday Monday,2024-01-22,"While most pre-professional societies do not have a residential section, Beta Upsilon Mu members creatively promote residential connections by commandeering a new common room to couch-surf in every week.",Campus Voices,https://www.dukechronicle.com/article/2024/01/012224-monday-monday-pre-professional-society
I'm glad It's Thyme replaced Panda ,Heidi Smith,2024-01-22,"No matter what type of cuisine it models, adding a restaurant that is trying to serve real food is an unambiguous win in my book.",Campus Voices,https://www.dukechronicle.com/article/2024/01/012224-smith-glad-its-thyme-replaced-panda
DukeEngage DC Democracy at Risk: An unlikely ally,Gabrielle Mollin,2024-01-19,"I’m miles away from identifying with the Republican party, but I can no longer impose false narratives onto their voter base.",Campus Voices,https://www.dukechronicle.com/article/2024/01/011924-mollin-democracy-unlikely-ally
Banning ChatGPT won’t stop cheating,Aaron Price,2024-01-19,"If classes continue to fail to provide the value students hope to derive from college, it won’t matter if AI is banned or not. Students will always find a way to cheat.",Campus Voices,https://www.dukechronicle.com/article/2024/01/011924-price-banning-chatgpt-cheating
It’s not too soon to say that QuadEx is failing,Gabriel Reis,2024-01-19,"Two years into QuadEx implementation and we are worse than where we started, with nearly zero residential excitement on this campus.",Opinion,https://www.dukechronicle.com/article/2024/01/011924-reis-quadex-failing
"At Duke, we serve ourselves",Advikaa Anand,2024-01-18,"Mandating service work as a graduation requirement would help diffuse the concentrated tensions around career building and professionalism to a useful cause, skillfully deploying Duke students’ talents in arenas where they can do good.",Campus Voices,https://www.dukechronicle.com/article/2024/01/011824-anand-we-serve-ourselves
Books will set you free,Carol Apollonio,2024-01-17,"I am kind of thinking that bitcoins themselves are a cheap form of fiction, but considerably less interesting than a random short story by a mildly talented writer.",Campus Voices,https://www.dukechronicle.com/article/2024/01/011724-apollonio-skeptical-books
Olive Garden as a metaphor for life,Nathan Luzum,2024-01-17,"Perhaps it’s sad to be in your mid-20s and have a well-honed strategy for getting your money’s worth out of a chain restaurant, but I choose to think of it as one of my charming qualities.",Campus Voices,https://www.dukechronicle.com/article/2024/01/011724-luzum-olive-garden
Letter from alumni: A response to Duke Students Supporting Israel,"Mark Pinsky , Jeffrey Gold and Douglas Schocken",2024-01-16,"In light of our view that there is no military solution to the Israel-Gaza War, we understand the calls for an immediate cease-fire. What is needed, however, is a fundamentally different discourse — one that recognizes the multiple conflicting truths and complexities that inextricably bind us as Israeli and Diaspora Jews and Palestinians.",Opinion,https://www.dukechronicle.com/article/2024/01/011624-gold-pinsky-schocken-letter
In memory of Martin Luther King Jr.: The wise caution of amos (especially to religious folk),Luke A. Powery,2024-01-15,"In his famous “I Have a Dream” speech, Martin Luther King Jr. quoted the prophet Amos, saying, “Justice rolls down like waters, and righteousness like a mighty stream.”",Campus Voices,https://www.dukechronicle.com/article/2024/01/011524-powery-martin-luther-king-jr-memory
The road to Wagner,Angikar Ghosal,2024-01-15,I have long considered the capacity to fervently sob to the prelude of ‘Tannhäuser’ as an indicator of virtuous moral character.,Campus Voices,https://www.dukechronicle.com/article/2024/01/031524-ghosal-road-to-wagner
When we are betrayed: Who to be and what to do?,Allegra Jordan and Theodore Ryan,2023-12-18,"We must also honor that we have invisible, moral injuries from how former Duke Football Coach Mike Elko left us.",Opinion,https://www.dukechronicle.com/article/2023/12/121823-jordan-ryan-elko-betrayal
Letter to Duke football players: Don't ever give up,Richard Byrd,2023-12-12,I can't imagine how difficult it must be for those of you who are facing the prospect of a third coaching staff in your time at Duke and are being asked to trust another group of coaches.,Letters to the Editor,https://www.dukechronicle.com/article/2023/12/101223-byrd-duke-football-letter
"'We've heard enough': The Chronicle to end 'Student Voices' columns, Monday Monday reports",Monday Monday,2023-12-11,Duke students have lived their whole lives being told they are smarter and more interesting than the average person. Opinion columnists dare to challenge this and say: “Untrue! Our opinions are just as boring as everyone else’s.” ,Campus Voices,https://www.dukechronicle.com/article/2023/12/121123-monday-monday-ending-student-voices
In defense of neutral space,Marc Brettler,2023-12-11,"Participants in the event — spanning a broad swath of political, religious, socio-economic and ethnic divides — called for more spaces at Duke in which to engage in civil discourse with people other people with differing viewpoints.",Opinion,https://www.dukechronicle.com/article/2023/12/101123-brettler-neutral-space-defense
A defense of the foreign language requirement,Henry Pickford,2023-12-11,"Foreign language and, more importantly, acquiring the higher-level experiences that are enabled by that facility in the foreign language — study abroad, engagement with intellectual works in the foreign language, etc. — should be an essential part of a liberal arts education.",Opinion,https://www.dukechronicle.com/article/2023/12/101123-pickford-foreign-language-requirement
No place like home,Valerie Tan,2023-12-08,Home was a place I had worked tirelessly and pleaded fervently to leave as soon as I was old enough to realize that the option existed.,Campus Voices,https://www.dukechronicle.com/article/2023/12/120823-tan-no-place-like-home
The convenience of more,Aaron Siegle,2023-12-08,"Commitment takes dedication, and dedication isn’t efficient.",Campus Voices,https://www.dukechronicle.com/article/2023/12/120823-siegle-convenience-of-more
"Duke's commitment is to fossil fuels, not the climate",Duke Climate Coalition,2023-12-08,"Duke needs to cut all ties with fossil fuel companies to ensure that it is actively supporting climate action and decarbonization, rather than playing into the interests of big oil.",Opinion,https://www.dukechronicle.com/article/2023/12/100823-duke-climate-coalition
Statement from Duke Students Supporting Israel: Israel has a right to defend itself against terrorism,Duke Students Supporting Israel,2023-12-07,Atrocities on both ends further emphasize our wish and the emphatic need for everyone — Israelis and Palestinians alike — to be free from Hamas.,Opinion,https://www.dukechronicle.com/article/2023/12/100723-duke-students-supporting-israel
Don’t limit thankfulness to a Thursday in November,Anna Garziera,2023-12-06,"As a rule of thumb, this is exactly what gratefulness affords us: a better perspective. By pinpointing what is most important to us, daily battles feel relatively insignificant.",Campus Voices,https://www.dukechronicle.com/article/2023/12/120623-garziera-dont-limit-thankfulness-to-november
Tunnel to DKU at former Panda Express site nears completion ,Monday Monday,2023-12-04,"After being a staple of dining for Duke students who loved underseasoned chicken for 15 years, Panda Express served its last rice bowl last May, leaving a gaping hole that has been under constant renovation ever since.",Campus Voices,https://www.dukechronicle.com/article/2023/12/120423-monday-monday-dku-tunnel-panda-express
Singing the blues,Luke A. Powery,2023-12-04,Singing the blues is an essential ingredient for anyone who wants to prepare for the way life is.,Campus Voices,https://www.dukechronicle.com/article/2023/12/120423-powery-singing-blues
Sandwich smackdown: Pitchfork’s fried chicken sandwich wins gold,Jessica Luan,2023-12-01,"There are definitely better fried chicken sandwiches out there, like at the Popeye’s at RDU or Cane’s on Franklin Street. But the Pitchforks sandwich is bewitchingly delicious, easily accessible and better than its on-campus competitors. ",Campus Voices,https://www.dukechronicle.com/article/2023/12/120123-luan-pitchforks-fried-chicken-sandwich
Have yourself a crafty Christmas,Morgan Foster,2023-12-01,"With reports of a cool-down in consumer spending coming out of last week's Black Friday, I imagine more people will forgo store-bought gifts — not out of protest, but out of necessity.",Campus Voices,https://www.dukechronicle.com/article/2023/12/120123-foster-crafty-christmas
Gatsbys at Duke University,Advikaa Anand,2023-11-30,"I don’t know why I have cared more about my physical appearance since coming here, but I do reckon it's something to do with the overall preppy, classy appearance of the Duke student body.",Campus Voices,https://www.dukechronicle.com/article/2023/11/113023-anand-gatsbys-duke-university
A case against QS,Sonia Green,2023-11-28,"The QS requirement is unnecessary, and doing away with it would give non-STEM students like me more freedom to pursue our academic and career interests.",Campus Voices,https://www.dukechronicle.com/article/2023/11/112823-green-qs-requirement-unnecessary
Do you really need that master's degree?,Heidi Smith,2023-11-27,We have been in the educational system all our lives; how much more can we gain from being a student for one to two more years?,Campus Voices,https://www.dukechronicle.com/article/2023/11/112723-smith-do-you-really-need-that-masters-degree
The case for maximalism,Angikar Ghosal,2023-11-27,"The thing about op-eds is that either an article echoes the overwhelmingly agreed view and did not convince anyone new, or it is an unpopular, hot take … and the article did not convince anyone new!",Campus Voices,https://www.dukechronicle.com/article/2023/11/112723-ghosal-maximalism-case
Ditch your four wheels and get on two: Biking to campus can improve your life,Bridget Gregory,2023-11-20,I implore my off-campus peers to consider biking or even walking instead of driving to campus.,Opinion,https://www.dukechronicle.com/article/2023/11/112023-gregory-biking-improve-life
Common aspirations,Luke A. Powery,2023-11-20,"When applying to college you want to set yourself apart and not be common. This helps you stand out from the pack. But in everyday life, you shouldn’t have to be distinct in order to be accepted.",Campus Voices,https://www.dukechronicle.com/article/2023/11/112023-powery-common-aspirations
We need a better way to get groceries,Zubin Rekhi,2023-11-17,The problem with the administration’s current shuttle model is its prioritization of the bare minimum — keeping students safe on-campus — without respecting any other concerns about students’ time or needs.,Campus Voices,https://www.dukechronicle.com/article/2023/11/111723-rekhi-groceries-campus-transportation
New caps on Duke-approved programs are elitist,Ellie Armstrong and Chris Paré,2023-11-16,The program caps not only add stress to the student body but also promote an elitist socioeconomic culture and a Western superiority complex.,Opinion,https://www.dukechronicle.com/article/2023/11/111623-armstrong-pare-duke-approved-program-caps
Contradicting Elsa: Sometimes it’s okay to not 'Let it Go',Advikaa Anand,2023-11-16,"Ultimately, forgiving someone is not about them; instead, it’s about us — it’s about our choice to rise above the pain that they have caused us, but only when we are ready, if we are ever ready.",Campus Voices,https://www.dukechronicle.com/article/2023/11/111623-anand-sometimes-okay-not-let-it-go
Duke needs to address its failure to identify human rights impacts when investing,Duke Amnesty International,2023-11-15,Duke Amnesty International is calling upon the Duke University Investment Management Company (DUMAC) to take responsibility for ethical decision-making regarding their investment of the Duke endowment.,Opinion,https://www.dukechronicle.com/article/2023/11/111523-amnesty-international-human-rights-due-diligence-investment-lack
Campus buses to install spikes to more easily kill cyclists,Monday Monday,2023-11-13,The new buses feature state-of-the-art spears positioned at the front and side of the buses to perfectly skewer any cyclist or skateboarder who dares to brave Campus Drive.,Campus Voices,https://www.dukechronicle.com/article/2023/11/111323-monday-monday-buses-cyclists
We need to rethink swag,Heidi Smith,2023-11-13,"Getting swag almost feels like being a lab rat pressing a pellet dispenser again and again — sometimes you get a treat, sometimes nothing and sometimes, frankly, a piece of shit that you have to figure out what to do with.",Campus Voices,https://www.dukechronicle.com/article/2023/11/111323-smith-rethink-swag
The irrelevance of median grades,Angikar Ghosal,2023-11-13,I have long held the notion that the 'median' grade is a mathematical formula that possesses no justifiable presence while defining grade thresholds. ,Campus Voices,https://www.dukechronicle.com/article/2023/11/111323-ghosal-the-irrelevance-of-media-grades
Don't let your hobbies die,Susan Chemmanoor,2023-11-10,"You’re doing yourself a disservice by committing to twenty academic pursuits you don’t even like, to reach an impossible standard of success defined by everyone else but you. ",Campus Voices,https://www.dukechronicle.com/article/2023/11/111023-chemmanoor-hobbies-student-work-passion
The 15-minute campus,Aaron Siegle,2023-11-10,A 15-minute campus is just one decision away.,Campus Voices,https://www.dukechronicle.com/article/2023/11/111023-siegle-15-minute-campus
The art of giving up,Valerie Tan,2023-11-08,"In hindsight, I’ve only regretted not quitting sooner.",Campus Voices,https://www.dukechronicle.com/article/2023/11/110823-tan-art-of-giving-up
Duke cannot be sustainable without you,Anna Garziera,2023-11-08,"We should shut the bathroom faucets at night before we resort to becoming vegan, in an effort to save the world. ",Campus Voices,https://www.dukechronicle.com/article/2023/11/110823-garziera-duke-cannot-be-sustainable-without-you
Human rights and campus climate statement on Gaza and Israel,"Rebecca Stein , Mona Hassan , Robin Kirk , Nancy MacLean , Erika Weinthal and James Chappel",2023-11-07,"We join human rights and civil society organizations across the globe in calling for the immediate, safe and sufficient provision of humanitarian aid to Gaza and the release of all hostages.",Letters to the Editor,https://www.dukechronicle.com/article/2023/11/110723-kirk-weinthal-human-rights-israel-gaza-statement
Lest we forget,Luke A. Powery,2023-11-06,"In this fall season of nostalgia and memory, I want to ask you: Who do you remember and who do you forget?",Campus Voices,https://www.dukechronicle.com/article/2023/11/110623-powery-lest-we-forget
The constant 'renovations' on Abele Quad are counterproductive,Zubin Rekhi,2023-11-03,"The tragedy is that while Duke’s administration squanders money by chiseling away at the edge of pavements, many small improvements — actually capable of strengthening a sense of community among students and improving student life — go completely overlooked.",Campus Voices,https://www.dukechronicle.com/article/2023/11/110323-rekhi-abele-quad-administration-studentlife
Naps in Neverland: Three things I’ll miss about Duke in the working world ,Jessica Luan,2023-11-03,"When my summer ended, I realized I should have cherished my college experience a lot sooner because of its flexibility, its friendships and its fleetingness. I sometimes thought Duke was a dungeon, but I should have realized it is Neverland.",Campus Voices,https://www.dukechronicle.com/article/2023/11/110323-luan-missing-duke
The legacy of the Duke Parapsychology Laboratory,Nik Narain,2023-11-03,"Most people don’t know that barely a mile off campus, there’s an entire research institute dedicated to parapsychology (PSI) — the study of psychic and paranormal phenomena.",Campus Voices,https://www.dukechronicle.com/article/2023/11/110323-narain-duke-parapsychology-labratory-legacy
In defense of the pick-me girl,Advikaa Anand,2023-11-02,Their overarching message is clear: Women can either be the feminine good or the masculine evil.,Campus Voices,https://www.dukechronicle.com/article/2023/11/110223-anand-pick-me-girl-defense
History’s role in race-based affirmative action,Sonia Green,2023-11-01,Race-based affirmative action is the only remedy to a historically inequitable system.,Campus Voices,https://www.dukechronicle.com/article/2023/11/103123-green-history-affirmative-action
The philosopher-therapist is in and they will see you now,Jess Jiang,2023-11-01,"Words don’t have to mean anything in and of themselves: They don’t have to conjure up a mental picture or reduce to some essential definition. Instead, we use words much like how we use game pieces, in a sort of language game we learn by observation.",Campus Voices,https://www.dukechronicle.com/article/2023/11/110123-jiang-philosopher-therapist
Your classes suck. It’s tenure’s fault,Aaron Price,2023-10-31,"After chatting with Duke administrators and professors striving for tenure, I learned that the expectation of “good teaching” is barely — if at all — considered compared to research output.",Campus Voices,https://www.dukechronicle.com/article/2023/10/103123-price-tenure
Ghosts of Halloweens past,Barbara Cardenas,2023-10-30,"As Halloween approaches each year, I find myself yearning for the expansive celebrations of my childhood. Not just for the costumes and the festivities, but for the sense of community, the shared experiences and the collective effervescence that the holiday symbolizes.",Campus Voices,https://www.dukechronicle.com/article/2023/10/103023-cardenas-halloween
HRL embraces inner troll in Halloween festivities,Monday Monday,2023-10-30,"If you’re still looking for a last-minute fit, don’t worry: Monday Monday has got you covered. Check out these eight easy costumes sure to wow the deans.",Campus Voices,https://www.dukechronicle.com/article/2023/10/103023-monday-monday-hrl-halloween
Redefining success: Embracing alternative assessments in higher education,Maria Kunath,2023-10-30,Exams create enormous amounts of anxieties that overburden the extraneous and germane aspects of cognitive load.,Opinion,https://www.dukechronicle.com/article/2023/10/103023-kunath-exams-higher-education
What's the big deal about New York?,Heidi Smith,2023-10-30,"“I, like everyone, want to go to New York City because everyone else wants to go to New York City.”",Campus Voices,https://www.dukechronicle.com/article/2023/10/103023-smith-big-deal-about-new-york
QuadEx may not be a bad idea,Angikar Ghosal,2023-10-30,"QuadEx does not claim to supplant existing social circles; rather, its intended purpose is to provide solace to those students who are atypically reserved or reticent or encounter financial constraints preventing them from indulging in a vibrant social life.",Campus Voices,https://www.dukechronicle.com/article/2023/10/103023-ghosal-quadex-not-a-bad-idea
An ode to the women’s bathroom,Umang Dhingra,2023-10-27,The women’s washroom — as momentary as it may be — is knowing that your nameless and faceless sisterhood is real.,Campus Voices,https://www.dukechronicle.com/article/2023/10/102723-dhingra-ode-to-the-womens-bathroom
Children of immigrants: On guilt and drive,Susan Chemmanoor,2023-10-27,"When I study for a test, I am not simply being a good student: I’m making good on a promise: a promise that I won’t let the sacrifices of the people who came before me go to waste.",Campus Voices,https://www.dukechronicle.com/article/2023/10/102723-chemmanoor-immigrant-dreams-burdens
The climate costs of conference realignment,Aaron Siegle,2023-10-27,Conference realignment isn’t only a tragedy because of the death of classic rivalries but also of the planet itself.,Campus Voices,https://www.dukechronicle.com/article/2023/10/102723-siegle-climate-costs-conference-realignment
Time to drop the foreign language requirement,Jean DuBois,2023-10-27,"Trinity's three-semester foreign language requirement is unnecessary, and there are much better ways to achieve its stated purpose of fostering “global understanding,” as Trinity’s website describes.",Opinion,https://www.dukechronicle.com/article/2023/10/102723-dubois-drop-foreign-language-requirement
Winter is coming. Get outside now!,Anna Sorensen,2023-10-27,I am beginning to reassociate what it means and how it feels to do work in college,Campus Voices,https://www.dukechronicle.com/article/2023/10/102723-sorensen-winter-is-coming-get-outside-now
Duke alumni: How Duke should address its lack of economic diversity,Maryellen Fullerton,2023-10-26,Duke leadership needs to set goals and take concrete actions to make the resources of Duke University accessible to a much more economically diverse student body. ,Opinion,https://www.dukechronicle.com/article/2023/10/102623-fullerton-alumni-economic-diversity-letter
Effective altriusm,Valerie Tan,2023-10-25,Is it selfish not to be selfless?,Campus Voices,https://www.dukechronicle.com/article/2023/10/102523-tan-effective-altruism
It is not too late to plant a tree,Anna Garziera,2023-10-25,"With two months left in the year, we have to act with conviction that it is not too late. Planting a seed today might get us at least a sprout by December. ",Campus Voices,https://www.dukechronicle.com/article/2023/10/102523-garziera-not-late-plant-tree
"Erasing Black history happens everywhere, even at Duke",Bella Naspinski,2023-10-24,"As people of America, it is our responsibility to not allow our history of violence against and oppression of Black communities to be swept under the rug.",Campus Voices,https://www.dukechronicle.com/article/2023/10/102423-naspinski-black-history
A contextualized understanding of the recent attacks in Israel and Palestine,Duke Students for Justice in Palestine,2023-10-23,"Widespread public response to recent events has erased the 75-year history of the Israeli occupation of Palestine. As such, in this article, we provide heavily-sourced and well-evidenced historical, political and humanitarian context that should preclude any understanding of the current turmoil. ",Opinion,https://www.dukechronicle.com/article/2023/10/102323-sjp-israel-palestine-contextualized-understanding
You are worthy,Luke A. Powery,2023-10-23,"You have worth and value as a human being therefore you should be honored, respected, trusted and included.",Campus Voices,https://www.dukechronicle.com/article/2023/10/102323-powery-you-are-worthy
My future is not for sale,Marie-Hélène Tomé,2023-10-20,We don’t have the time to let Duke stall. We don’t have time to admire the problem in seminar series discussing Duke’s obligation to invest morally. We need climate action.,Opinion,https://www.dukechronicle.com/article/2023/10/102023-tome-duke-divestment-climate
